{
  "schema_version": 1,
  "work_id": "00000000-0000-0000-0000-000000000001",
  "turn_id": "00000000-0000-0000-0000-000000000002",
  "kind": "implementation_result",
  "summary": "Completed initial foundation batch T001-T011",
  "claimed_files": [
    "scripts/ai/collaboration_bridge.py",
    "scripts/ai/collaboration/state.py"
  ],
  "checks": [
    {
      "criterion_id": "C001",
      "task_id": "T007",
      "status": "passed",
      "command_or_description": "python -m unittest tests/ai/collaboration/test_state.py",
      "exit_code": 0,
      "evidence": "Ran 12 tests in 0.05s - OK",
      "limitation": null
    },
    {
      "criterion_id": "C002",
      "task_id": "T011",
      "status": "not_run",
      "command_or_description": "Live provider test",
      "exit_code": null,
      "evidence": null,
      "limitation": "Live provider execution reserved for independent Codex review"
    }
  ],
  "remaining_actions": [
    "Independent verification by Codex"
  ],
  "question": null,
  "block_reason": null
}
